{
  "lock_version": "2.0.0",
  "generated_at": "2026-07-18",
  "prohibited_dependency_ids": ["curl-impersonate", "firecrawl", "scrapling"],
  "skill_dependencies": [
    {
      "id": "ppt-master",
      "optional": false,
      "repository": "https://github.com/hugohe3/ppt-master.git",
      "commit": "8858c4960b870f12baf952994fbd0c76ab5ba4ec",
      "tree_sha": "1dfb037fd092debad65016ca559e9f30c4007432",
      "license_spdx": "MIT",
      "license_file": "LICENSE",
      "source_skill_path": "skills/ppt-master",
      "destination_name": "ppt-master",
      "runtime_environment": "skill_only_no_runtime_environment",
      "expected_blobs": [
        {"path": "LICENSE", "sha": "9c261c3d9a1d3249fa8f18611c950d719d288560"},
        {"path": "skills/ppt-master/SKILL.md", "sha": "98f5b893ae3332a56beec9a1fc5f6ebd4de1c31b"}
      ]
    }
  ],
  "runtime_dependencies": [
    {
      "id": "crawl4ai-runtime",
      "optional": true,
      "runtime_kind": "isolated_python_browser_runtime",
      "python_version": "3.13.14",
      "project_definition": "references/crawl4ai-runtime/pyproject.toml",
      "project_lock": "references/crawl4ai-runtime/uv.lock",
      "browser_lock": "references/crawl4ai-runtime/browser-lock.json",
      "browser_metadata": "references/crawl4ai-runtime/playwright-browsers.json",
      "distribution": {
        "name": "crawl4ai",
        "version": "0.9.2",
        "artifact_url": "https://files.pythonhosted.org/packages/e0/fe/84960a1747d64d12b4a0d6d9954ee919e44a92dd62e64152552c4e5bf437/crawl4ai-0.9.2-py3-none-any.whl",
        "sha256": "4efb2d0688aa3d66b48721a9031f7257bd2acb52b78d0a89d072741ac685f3f8"
      },
      "browser_engine": {
        "provider": "playwright",
        "package_version": "1.61.0",
        "chromium_revision": "1228",
        "chromium_version": "149.0.7827.55",
        "browsers_json_sha256": "ee39bc924bc3d1bd895626c2910f1292d109bbfeeb5abd113acb45e1951cc942",
        "installed_directory": "chromium-1228"
      },
      "installation_commands": [
        "uv python install 3.13.14",
        "uv sync --project <runtime-root> --python 3.13.14 --frozen --no-dev",
        "<runtime-root>/.venv/Scripts/python.exe -m playwright install chromium"
      ],
      "receipt_file": ".architecture-pre-design-crawl4ai-runtime.json",
      "supported_platform": "windows-x86_64",
      "prohibited_capabilities": [
        "undetected_browser_mode",
        "stealth_integration",
        "proxy_configuration",
        "custom_user_agent",
        "random_user_agent",
        "browser_script_injection",
        "fallback_fetch_function",
        "cookie_import",
        "credential_or_login_state",
        "captcha_solving",
        "cloudflare_solving",
        "browser_impersonation"
      ],
      "upstream_license": {
        "spdx": "Apache-2.0",
        "license_url": "https://raw.githubusercontent.com/unclecode/crawl4ai/v0.9.2/LICENSE",
        "attribution_notice_required": true
      }
    }
  ]
}
